event,date,category,lifter_name,bodyweight,snatch_1,snatch_2,snatch_3,cj_1,cj_2,cj_3,best_snatch,best_cj,total
SOUTH-AMERICAN CHAMPIONSHIPS,2015-12-09,56 kg Men,FERRUZOLA ALAVA Rafael Patricio,55.48,100,-104,104,122,126,-130,104,126,230
SOUTH-AMERICAN CHAMPIONSHIPS,2015-12-09,56 kg Men,ZURITA VALLEJO Walter Freddy,55.78,104,-109,-109,130,-135,135,104,135,239
SOUTH-AMERICAN CHAMPIONSHIPS,2015-12-09,56 kg Men,ROJAS CONCHA Marcos Antonio,55.82,100,-104,104,131,136,-140,104,136,240
SOUTH-AMERICAN CHAMPIONSHIPS,2015-12-09,56 kg Men,BARRERA SANDOVAL Francisco Javier,55.76,-101,-101,101,129,-131,131,101,131,232
SOUTH-AMERICAN CHAMPIONSHIPS,2015-12-09,56 kg Men,GASTELO CARRERA George Ulises,53.95,85,90,95,105,110,115,95,115,210
SOUTH-AMERICAN CHAMPIONSHIPS,2015-12-09,62 kg Men,BARDALEZ TUISIMA Luis David,61.80,110,115,118,137,142,146,118,146,264
SOUTH-AMERICAN CHAMPIONSHIPS,2015-12-09,62 kg Men,PRECIADO REYES Miguel Angel,61.76,105,108,111,-132,132,138,111,138,249
SOUTH-AMERICAN CHAMPIONSHIPS,2015-12-09,62 kg Men,FERNANDES SILVEIRA Gabriel,61.43,-105,105,-110,128,131,-138,105,131,236
SOUTH-AMERICAN CHAMPIONSHIPS,2015-12-09,62 kg Men,JIMENES Nahuel Carlos Daniel,61.71,96,101,-106,125,130,136,101,136,237
SOUTH-AMERICAN CHAMPIONSHIPS,2015-12-09,69 kg Men,ANDRADE DE SOUSA Matheus Delan,68.48,115,-120,120,145,-151,-153,120,145,265
SOUTH-AMERICAN CHAMPIONSHIPS,2015-12-09,69 kg Men,TERRONES MIRANDA Oscar Adrian,67.94,113,117,-120,145,150,-154,117,150,267
SOUTH-AMERICAN CHAMPIONSHIPS,2015-12-09,69 kg Men,SOTO MONTECINO Eduardo Alexis,68.09,107,112,-115,135,141,146,112,146,258
SOUTH-AMERICAN CHAMPIONSHIPS,2015-12-09,77 kg Men,LOPEZ FARIAS Bastian Andres,76.43,127,131,132,162,166,171,132,171,303
SOUTH-AMERICAN CHAMPIONSHIPS,2015-12-09,77 kg Men,GASPAR MACHADO Rafael,76.16,124,128,131,160,164,170,131,170,301
SOUTH-AMERICAN CHAMPIONSHIPS,2015-12-09,77 kg Men,SANCHEZ REYES Jordan Abel,70.94,126,129,-132,158,163,-167,129,163,292
SOUTH-AMERICAN CHAMPIONSHIPS,2015-12-09,77 kg Men,ARROYO VALDEZ Felix Dario,75.46,122,-127,-127,150,155,-158,122,155,277
SOUTH-AMERICAN CHAMPIONSHIPS,2015-12-09,77 kg Men,GOMES DOS SANTOS Jonatan,72.99,-112,112,-115,-141,-141,141,112,141,253
SOUTH-AMERICAN CHAMPIONSHIPS,2015-12-09,77 kg Men,YOHAMONA LEON Pedro Luis,69.79,105,-110,110,135,140,143,110,143,253
SOUTH-AMERICAN CHAMPIONSHIPS,2015-12-09,77 kg Men,ORTIZ PARRA Miguel Angel Andres,75.68,100,105,-110,125,130,133,105,133,238
SOUTH-AMERICAN CHAMPIONSHIPS,2015-12-09,85 kg Men,FERREIRA DA SILVA Josue Lucas,83.71,145,150,-155,170,176,180,150,180,330
SOUTH-AMERICAN CHAMPIONSHIPS,2015-12-09,85 kg Men,CONTRERAS CHAMORRO Wilmer Eduardo,85.00,145,-149,-151,171,175,177,145,177,322
SOUTH-AMERICAN CHAMPIONSHIPS,2015-12-09,85 kg Men,ROSA DA SILVA Welisson,84.57,130,140,-146,156,170,180,140,180,320
SOUTH-AMERICAN CHAMPIONSHIPS,2015-12-09,85 kg Men,WORMALD CISTERNA Kevin Enrique,78.55,115,-122,127,140,150,155,127,155,282
SOUTH-AMERICAN CHAMPIONSHIPS,2015-12-09,94 kg Men,MARTINS Romario Paulo,93.09,-145,145,150,176,183,-192,150,183,333
SOUTH-AMERICAN CHAMPIONSHIPS,2015-12-09,94 kg Men,PALACIOS Ivan,92.24,132,140,147,167,175,182,147,182,329
SOUTH-AMERICAN CHAMPIONSHIPS,2015-12-09,94 kg Men,JUANICO PUPPO Enrique,89.20,110,116,-120,135,139,-145,116,139,255
SOUTH-AMERICAN CHAMPIONSHIPS,2015-12-09,94 kg Men,NAVARRETE VARGAS Juan Antonio,91.79,95,102,-107,125,132,138,102,138,240
SOUTH-AMERICAN CHAMPIONSHIPS,2015-12-09,105 kg Men,VIERA ESPINOZA Hernan Moises,103.89,145,151,-156,-190,190,200,151,200,351
SOUTH-AMERICAN CHAMPIONSHIPS,2015-12-09,105 kg Men,ARROYO VALDEZ Dixon Bladimir,95.66,125,131,138,153,160,165,138,165,303
SOUTH-AMERICAN CHAMPIONSHIPS,2015-12-09,105 kg Men,VALENCIA MONTESINOS Alex Dario,97.30,120,126,-132,150,161,166,126,166,292
SOUTH-AMERICAN CHAMPIONSHIPS,2015-12-09,105 kg Men,MORALES GONZALEZ Brandon Alexander,94.98,95,108,-118,125,-130,134,108,134,242
SOUTH-AMERICAN CHAMPIONSHIPS,2015-12-09,105 kg Men,MARRA CALABRIA Rodrigo Sebastian,103.44,100,-110,-114,120,130,-142,100,130,230
SOUTH-AMERICAN CHAMPIONSHIPS,2015-12-09,+105 kg Men,CALERO TORRES Anderson Jimmy,156.92,165,-169,-170,-195,195,200,165,200,365
SOUTH-AMERICAN CHAMPIONSHIPS,2015-12-09,+105 kg Men,GREGORIO MACHADO Mateus Filipe,107.90,160,-165,-165,190,195,200,160,200,360
SOUTH-AMERICAN CHAMPIONSHIPS,2015-12-09,+105 kg Men,CARABALI QUINTERO Milton Elias,145.45,140,145,151,190,201,-207,151,201,352
SOUTH-AMERICAN CHAMPIONSHIPS,2015-12-09,+105 kg Men,COTO PEREIRA Emanuel,125.90,131,135,140,170,-177,-177,140,170,310
SOUTH-AMERICAN CHAMPIONSHIPS,2015-12-09,+105 kg Men,MICHELIN-SALOMON Bralan M.,117.55,120,-130,-132,150,-157,-157,120,150,270
SOUTH-AMERICAN CHAMPIONSHIPS,2015-12-09,48 kg Women,DE SOUZA FACCIOLLA FERREIRA Aline,47.94,74,77,-80,89,92,-95,77,92,169
SOUTH-AMERICAN CHAMPIONSHIPS,2015-12-09,48 kg Women,OLIVEIRA MADEIRA Luana,47.56,-75,75,-78,-88,-88,-89,75,0,0
SOUTH-AMERICAN CHAMPIONSHIPS,2015-12-09,48 kg Women,CAMPOVERDE ALMEIDA Angelica Mercedes,47.47,66,-70,70,85,-89,89,70,89,159
SOUTH-AMERICAN CHAMPIONSHIPS,2015-12-09,48 kg Women,ARAVENA VASQUEZ Allianni M.D.L.A.,47.16,45,50,-53,55,-60,-60,50,55,105
SOUTH-AMERICAN CHAMPIONSHIPS,2015-12-09,53 kg Women,DE AGUIAR GONCALVES Alexsandra,52.97,80,84,-87,-100,-101,101,84,101,185
SOUTH-AMERICAN CHAMPIONSHIPS,2015-12-09,53 kg Women,CARRIEL CAJAPE Stefani Jamileth,52.63,70,73,76,90,95,-99,76,95,171
SOUTH-AMERICAN CHAMPIONSHIPS,2015-12-09,53 kg Women,PAREDES VASQUEZ Eldi Jhasmin,52.52,62,66,68,82,86,89,68,89,157
SOUTH-AMERICAN CHAMPIONSHIPS,2015-12-09,58 kg Women,DOS REIS SANTOS Rosane,57.35,-85,-85,85,100,-105,-105,85,100,185
SOUTH-AMERICAN CHAMPIONSHIPS,2015-12-09,58 kg Women,MEGO CONTRERAS Shoely Mabel,55.41,67,-70,70,88,92,95,70,95,165
SOUTH-AMERICAN CHAMPIONSHIPS,2015-12-09,58 kg Women,SILVA RAMIREZ Stefania Nicole,53.60,58,62,-64,70,74,-76,62,74,136
SOUTH-AMERICAN CHAMPIONSHIPS,2015-12-09,58 kg Women,VILLARROEL AGRAMONT Daniela N.,57.22,55,-60,-61,-70,70,75,0,0,0
SOUTH-AMERICAN CHAMPIONSHIPS,2015-12-09,63 kg Women,NAZARENO PERALTA Yadira Maria,61.61,78,83,84,101,106,-110,84,106,190
SOUTH-AMERICAN CHAMPIONSHIPS,2015-12-09,63 kg Women,NASCIMENTO SILVA A FERREIRA Eliane,61.52,78,-83,83,96,-103,-105,83,96,179
SOUTH-AMERICAN CHAMPIONSHIPS,2015-12-09,63 kg Women,NASCIMENTO PILOTO Bruna Luana,62.16,-80,-80,80,105,110,-115,80,110,190
SOUTH-AMERICAN CHAMPIONSHIPS,2015-12-09,63 kg Women,CAJAS QUIROZ Yomara Esther,61.82,70,74,77,90,-95,-95,77,90,167
SOUTH-AMERICAN CHAMPIONSHIPS,2015-12-09,69 kg Women,GALLEGOS CUTIPA Kelly Milagros,63.02,62,65,-67,85,89,91,65,91,156
SOUTH-AMERICAN CHAMPIONSHIPS,2015-12-09,75 kg Women,LIMA DE ARAUJO Monique Maria,74.80,105,-110,110,-120,120,-128,110,120,230
SOUTH-AMERICAN CHAMPIONSHIPS,2015-12-09,75 kg Women,ZAMBRANO BODERO Rubi Corina,70.89,45,48,50,57,-60,60,50,60,110
SOUTH-AMERICAN CHAMPIONSHIPS,2015-12-09,+75 kg Women,CORTEZ GARCIA Elizabeth Del Rosario,144.40,75,82,85,95,105,115,85,115,200
SOUTH-AMERICAN CHAMPIONSHIPS,2015-12-09,+75 kg Women,PORTELA MILICHIO Mercedes Noemi,76.42,63,66,-70,86,91,95,66,95,161
SOUTH-AMERICAN CHAMPIONSHIPS,2015-12-09,+75 kg Women,OLANO FASANANDO Diana Del Pilar,81.44,50,55,-58,60,-64,64,55,64,119
